id_dedl,original,upper,missions,unsep,rmstr,split
,49158da0-3c6c-11e2-81c1-0800200c9a66,49158DA0-3C6C-11E2-81C1-0800200C9A66,49158DA0-3C6C-11E2-81C1-0800200C9A66,49158DA0 3C6C 11E2 81C1 0800200C9A66,49158DA0 3C6C 11E2 81C1 0800200C9A66,"['49158DA0', '3C6C', '11E2', '81C1', '0800200C9A66']"
,49158da1-3c6c-11e2-81c1-0800200c9a66,49158DA1-3C6C-11E2-81C1-0800200C9A66,49158DA1-3C6C-11E2-81C1-0800200C9A66,49158DA1 3C6C 11E2 81C1 0800200C9A66,49158DA1 3C6C 11E2 81C1 0800200C9A66,"['49158DA1', '3C6C', '11E2', '81C1', '0800200C9A66']"
,49158da2-3c6c-11e2-81c1-0800200c9a66,49158DA2-3C6C-11E2-81C1-0800200C9A66,49158DA2-3C6C-11E2-81C1-0800200C9A66,49158DA2 3C6C 11E2 81C1 0800200C9A66,49158DA2 3C6C 11E2 81C1 0800200C9A66,"['49158DA2', '3C6C', '11E2', '81C1', '0800200C9A66']"
,49158da3-3c6c-11e2-81c1-0800200c9a66,49158DA3-3C6C-11E2-81C1-0800200C9A66,49158DA3-3C6C-11E2-81C1-0800200C9A66,49158DA3 3C6C 11E2 81C1 0800200C9A66,49158DA3 3C6C 11E2 81C1 0800200C9A66,"['49158DA3', '3C6C', '11E2', '81C1', '0800200C9A66']"
,848a1c10-830e-11e1-b0c4-0800200c9a6,848A1C10-830E-11E1-B0C4-0800200C9A6,848A1C10-830E-11E1-B0C4-0800200C9A6,848A1C10 830E 11E1 B0C4 0800200C9A6,848A1C10 830E 11E1 B0C4 0800200C9A6,"['848A1C10', '830E', '11E1', 'B0C4', '0800200C9A6']"
,94542540-a0a7-11e0-8264-0800200c9a66,94542540-A0A7-11E0-8264-0800200C9A66,94542540-A0A7-11E0-8264-0800200C9A66,94542540 A0A7 11E0 8264 0800200C9A66,94542540 A0A7 11E0 8264 0800200C9A66,"['94542540', 'A0A7', '11E0', '8264', '0800200C9A66']"
,96f64bd0-830e-11e1-b0c4-0800200c9a66,96F64BD0-830E-11E1-B0C4-0800200C9A66,96F64BD0-830E-11E1-B0C4-0800200C9A66,96F64BD0 830E 11E1 B0C4 0800200C9A66,96F64BD0 830E 11E1 B0C4 0800200C9A66,"['96F64BD0', '830E', '11E1', 'B0C4', '0800200C9A66']"
,EO:VITO:gl2:bp01:ndvi:continents,EO:VITO:GL2:BP01:NDVI:CONTINENTS,EO:VITO:GL2:BP01:NDVI:CONTINENTS,EO VITO GL2 BP01 NDVI CONTINENTS, CLMS GL2 BP01 NDVI CONTINENTS,"['', 'CLMS', 'GL2', 'BP01', 'NDVI', 'CONTINENTS']"
,EO:VITO:gl2:bp01:ndvi:tiles,EO:VITO:GL2:BP01:NDVI:TILES,EO:VITO:GL2:BP01:NDVI:TILES,EO VITO GL2 BP01 NDVI TILES, CLMS GL2 BP01 NDVI TILES,"['', 'CLMS', 'GL2', 'BP01', 'NDVI', 'TILES']"
,EO:VITO:gl2:bp02:BA:continents,EO:VITO:GL2:BP02:BA:CONTINENTS,EO:VITO:GL2:BP02:BA:CONTINENTS,EO VITO GL2 BP02 BA CONTINENTS, CLMS GL2 BP02 BA CONTINENTS,"['', 'CLMS', 'GL2', 'BP02', 'BA', 'CONTINENTS']"
,EO:VITO:gl2:bp02:BA:tiles,EO:VITO:GL2:BP02:BA:TILES,EO:VITO:GL2:BP02:BA:TILES,EO VITO GL2 BP02 BA TILES, CLMS GL2 BP02 BA TILES,"['', 'CLMS', 'GL2', 'BP02', 'BA', 'TILES']"
,EO:VITO:gl2:bp05:VCI:continents,EO:VITO:GL2:BP05:VCI:CONTINENTS,EO:VITO:GL2:BP05:VCI:CONTINENTS,EO VITO GL2 BP05 VCI CONTINENTS, CLMS GL2 BP05 VCI CONTINENTS,"['', 'CLMS', 'GL2', 'BP05', 'VCI', 'CONTINENTS']"
,EO:VITO:gl2:bp05:VCI:tiles,EO:VITO:GL2:BP05:VCI:TILES,EO:VITO:GL2:BP05:VCI:TILES,EO VITO GL2 BP05 VCI TILES, CLMS GL2 BP05 VCI TILES,"['', 'CLMS', 'GL2', 'BP05', 'VCI', 'TILES']"
,EO:VITO:gl2:bp05:VPI:continents,EO:VITO:GL2:BP05:VPI:CONTINENTS,EO:VITO:GL2:BP05:VPI:CONTINENTS,EO VITO GL2 BP05 VPI CONTINENTS, CLMS GL2 BP05 VPI CONTINENTS,"['', 'CLMS', 'GL2', 'BP05', 'VPI', 'CONTINENTS']"
,EO:VITO:gl2:bp05:VPI:tiles,EO:VITO:GL2:BP05:VPI:TILES,EO:VITO:GL2:BP05:VPI:TILES,EO VITO GL2 BP05 VPI TILES, CLMS GL2 BP05 VPI TILES,"['', 'CLMS', 'GL2', 'BP05', 'VPI', 'TILES']"
,fa414900-a0a7-11e0-8264-0800200c9a66,FA414900-A0A7-11E0-8264-0800200C9A66,FA414900-A0A7-11E0-8264-0800200C9A66,FA414900 A0A7 11E0 8264 0800200C9A66,FA414900 A0A7 11E0 8264 0800200C9A66,"['FA414900', 'A0A7', '11E0', '8264', '0800200C9A66']"
,urn:cgls:continents:lie_v1_250m,URN:CGLS:CONTINENTS:LIE_V1_250M,URN:CGLS:CONTINENTS:LIE_V1_250M,URN CGLS CONTINENTS LIE V1 250M,CLMS CONTINENTS LIE V1 250M,"['CLMS', 'CONTINENTS', 'LIE', 'V1', '250M']"
,urn:cgls:continents:sce500_v1_0.005degree,URN:CGLS:CONTINENTS:SCE500_V1_0.005DEGREE,URN:CGLS:CONTINENTS:SCE500_V1_0.005DEGREE,URN CGLS CONTINENTS SCE500 V1 0.005DEGREE,CLMS CONTINENTS SCE500 V1 0.005DEGREE,"['CLMS', 'CONTINENTS', 'SCE500', 'V1', '0.005DEGREE']"
,urn:cgls:continents:wb_v1_1km,URN:CGLS:CONTINENTS:WB_V1_1KM,URN:CGLS:CONTINENTS:WB_V1_1KM,URN CGLS CONTINENTS WB V1 1KM,CLMS CONTINENTS WB V1 1KM,"['CLMS', 'CONTINENTS', 'WB', 'V1', '1KM']"
,urn:cgls:global:albh_v1_1km,URN:CGLS:GLOBAL:ALBH_V1_1KM,URN:CGLS:GLOBAL:ALBH_V1_1KM,URN CGLS GLOBAL ALBH V1 1KM,CLMS GLOBAL ALBH V1 1KM,"['CLMS', 'GLOBAL', 'ALBH', 'V1', '1KM']"
,urn:cgls:global:aldh_v1_1km,URN:CGLS:GLOBAL:ALDH_V1_1KM,URN:CGLS:GLOBAL:ALDH_V1_1KM,URN CGLS GLOBAL ALDH V1 1KM,CLMS GLOBAL ALDH V1 1KM,"['CLMS', 'GLOBAL', 'ALDH', 'V1', '1KM']"
,urn:cgls:global:ba300_v1_333m,URN:CGLS:GLOBAL:BA300_V1_333M,URN:CGLS:GLOBAL:BA300_V1_333M,URN CGLS GLOBAL BA300 V1 333M,CLMS GLOBAL BA300 V1 333M,"['CLMS', 'GLOBAL', 'BA300', 'V1', '333M']"
,urn:cgls:global:ba300_v3_333m,URN:CGLS:GLOBAL:BA300_V3_333M,URN:CGLS:GLOBAL:BA300_V3_333M,URN CGLS GLOBAL BA300 V3 333M,CLMS GLOBAL BA300 V3 333M,"['CLMS', 'GLOBAL', 'BA300', 'V3', '333M']"
,urn:cgls:global:dmp300_v1_333m,URN:CGLS:GLOBAL:DMP300_V1_333M,URN:CGLS:GLOBAL:DMP300_V1_333M,URN CGLS GLOBAL DMP300 V1 333M,CLMS GLOBAL DMP300 V1 333M,"['CLMS', 'GLOBAL', 'DMP300', 'V1', '333M']"
,urn:cgls:global:dmp_v2_1km,URN:CGLS:GLOBAL:DMP_V2_1KM,URN:CGLS:GLOBAL:DMP_V2_1KM,URN CGLS GLOBAL DMP V2 1KM,CLMS GLOBAL DMP V2 1KM,"['CLMS', 'GLOBAL', 'DMP', 'V2', '1KM']"
,urn:cgls:global:fapar300_v1_333m,URN:CGLS:GLOBAL:FAPAR300_V1_333M,URN:CGLS:GLOBAL:FAPAR300_V1_333M,URN CGLS GLOBAL FAPAR300 V1 333M,CLMS GLOBAL FAPAR300 V1 333M,"['CLMS', 'GLOBAL', 'FAPAR300', 'V1', '333M']"
,urn:cgls:global:fapar_v1_1km,URN:CGLS:GLOBAL:FAPAR_V1_1KM,URN:CGLS:GLOBAL:FAPAR_V1_1KM,URN CGLS GLOBAL FAPAR V1 1KM,CLMS GLOBAL FAPAR V1 1KM,"['CLMS', 'GLOBAL', 'FAPAR', 'V1', '1KM']"
,urn:cgls:global:fapar_v2_1km,URN:CGLS:GLOBAL:FAPAR_V2_1KM,URN:CGLS:GLOBAL:FAPAR_V2_1KM,URN CGLS GLOBAL FAPAR V2 1KM,CLMS GLOBAL FAPAR V2 1KM,"['CLMS', 'GLOBAL', 'FAPAR', 'V2', '1KM']"
,urn:cgls:global:fcover300_v1_333m,URN:CGLS:GLOBAL:FCOVER300_V1_333M,URN:CGLS:GLOBAL:FCOVER300_V1_333M,URN CGLS GLOBAL FCOVER300 V1 333M,CLMS GLOBAL FCOVER300 V1 333M,"['CLMS', 'GLOBAL', 'FCOVER300', 'V1', '333M']"
,urn:cgls:global:fcover_v1_1km,URN:CGLS:GLOBAL:FCOVER_V1_1KM,URN:CGLS:GLOBAL:FCOVER_V1_1KM,URN CGLS GLOBAL FCOVER V1 1KM,CLMS GLOBAL FCOVER V1 1KM,"['CLMS', 'GLOBAL', 'FCOVER', 'V1', '1KM']"
,urn:cgls:global:fcover_v2_1km,URN:CGLS:GLOBAL:FCOVER_V2_1KM,URN:CGLS:GLOBAL:FCOVER_V2_1KM,URN CGLS GLOBAL FCOVER V2 1KM,CLMS GLOBAL FCOVER V2 1KM,"['CLMS', 'GLOBAL', 'FCOVER', 'V2', '1KM']"
,urn:cgls:global:gdmp300_v1_333m,URN:CGLS:GLOBAL:GDMP300_V1_333M,URN:CGLS:GLOBAL:GDMP300_V1_333M,URN CGLS GLOBAL GDMP300 V1 333M,CLMS GLOBAL GDMP300 V1 333M,"['CLMS', 'GLOBAL', 'GDMP300', 'V1', '333M']"
,urn:cgls:global:gdmp_v2_1km,URN:CGLS:GLOBAL:GDMP_V2_1KM,URN:CGLS:GLOBAL:GDMP_V2_1KM,URN CGLS GLOBAL GDMP V2 1KM,CLMS GLOBAL GDMP V2 1KM,"['CLMS', 'GLOBAL', 'GDMP', 'V2', '1KM']"
,urn:cgls:global:lai300_v1_333m,URN:CGLS:GLOBAL:LAI300_V1_333M,URN:CGLS:GLOBAL:LAI300_V1_333M,URN CGLS GLOBAL LAI300 V1 333M,CLMS GLOBAL LAI300 V1 333M,"['CLMS', 'GLOBAL', 'LAI300', 'V1', '333M']"
,urn:cgls:global:lai_v1_1km,URN:CGLS:GLOBAL:LAI_V1_1KM,URN:CGLS:GLOBAL:LAI_V1_1KM,URN CGLS GLOBAL LAI V1 1KM,CLMS GLOBAL LAI V1 1KM,"['CLMS', 'GLOBAL', 'LAI', 'V1', '1KM']"
,urn:cgls:global:lai_v2_1km,URN:CGLS:GLOBAL:LAI_V2_1KM,URN:CGLS:GLOBAL:LAI_V2_1KM,URN CGLS GLOBAL LAI V2 1KM,CLMS GLOBAL LAI V2 1KM,"['CLMS', 'GLOBAL', 'LAI', 'V2', '1KM']"
,urn:cgls:global:lcc100_v3_100m,URN:CGLS:GLOBAL:LCC100_V3_100M,URN:CGLS:GLOBAL:LCC100_V3_100M,URN CGLS GLOBAL LCC100 V3 100M,CLMS GLOBAL LCC100 V3 100M,"['CLMS', 'GLOBAL', 'LCC100', 'V3', '100M']"
,urn:cgls:global:lie_nh_v1_500m,URN:CGLS:GLOBAL:LIE_NH_V1_500M,URN:CGLS:GLOBAL:LIE_NH_V1_500M,URN CGLS GLOBAL LIE NH V1 500M,CLMS GLOBAL LIE NH V1 500M,"['CLMS', 'GLOBAL', 'LIE', 'NH', 'V1', '500M']"
,urn:cgls:global:lst10-dc_v1_0.045degree,URN:CGLS:GLOBAL:LST10-DC_V1_0.045DEGREE,URN:CGLS:GLOBAL:LST10-DC_V1_0.045DEGREE,URN CGLS GLOBAL LST10 DC V1 0.045DEGREE,CLMS GLOBAL LST10 DC V1 0.045DEGREE,"['CLMS', 'GLOBAL', 'LST10', 'DC', 'V1', '0.045DEGREE']"
,urn:cgls:global:lst10-dc_v2_0.045degree,URN:CGLS:GLOBAL:LST10-DC_V2_0.045DEGREE,URN:CGLS:GLOBAL:LST10-DC_V2_0.045DEGREE,URN CGLS GLOBAL LST10 DC V2 0.045DEGREE,CLMS GLOBAL LST10 DC V2 0.045DEGREE,"['CLMS', 'GLOBAL', 'LST10', 'DC', 'V2', '0.045DEGREE']"
,urn:cgls:global:lst10-tci_v1_0.045degree,URN:CGLS:GLOBAL:LST10-TCI_V1_0.045DEGREE,URN:CGLS:GLOBAL:LST10-TCI_V1_0.045DEGREE,URN CGLS GLOBAL LST10 TCI V1 0.045DEGREE,CLMS GLOBAL LST10 TCI V1 0.045DEGREE,"['CLMS', 'GLOBAL', 'LST10', 'TCI', 'V1', '0.045DEGREE']"
,urn:cgls:global:lst10-tci_v2_0.045degree,URN:CGLS:GLOBAL:LST10-TCI_V2_0.045DEGREE,URN:CGLS:GLOBAL:LST10-TCI_V2_0.045DEGREE,URN CGLS GLOBAL LST10 TCI V2 0.045DEGREE,CLMS GLOBAL LST10 TCI V2 0.045DEGREE,"['CLMS', 'GLOBAL', 'LST10', 'TCI', 'V2', '0.045DEGREE']"
,urn:cgls:global:lst_v1_0.045degree,URN:CGLS:GLOBAL:LST_V1_0.045DEGREE,URN:CGLS:GLOBAL:LST_V1_0.045DEGREE,URN CGLS GLOBAL LST V1 0.045DEGREE,CLMS GLOBAL LST V1 0.045DEGREE,"['CLMS', 'GLOBAL', 'LST', 'V1', '0.045DEGREE']"
,urn:cgls:global:lst_v2_0.045degree,URN:CGLS:GLOBAL:LST_V2_0.045DEGREE,URN:CGLS:GLOBAL:LST_V2_0.045DEGREE,URN CGLS GLOBAL LST V2 0.045DEGREE,CLMS GLOBAL LST V2 0.045DEGREE,"['CLMS', 'GLOBAL', 'LST', 'V2', '0.045DEGREE']"
,urn:cgls:global:lswt_v1_1km,URN:CGLS:GLOBAL:LSWT_V1_1KM,URN:CGLS:GLOBAL:LSWT_V1_1KM,URN CGLS GLOBAL LSWT V1 1KM,CLMS GLOBAL LSWT V1 1KM,"['CLMS', 'GLOBAL', 'LSWT', 'V1', '1KM']"
,urn:cgls:global:lswt_v1_1km_offline,URN:CGLS:GLOBAL:LSWT_V1_1KM_OFFLINE,URN:CGLS:GLOBAL:LSWT_V1_1KM_OFFLINE,URN CGLS GLOBAL LSWT V1 1KM OFFLINE,CLMS GLOBAL LSWT V1 1KM OFFLINE,"['CLMS', 'GLOBAL', 'LSWT', 'V1', '1KM', 'OFFLINE']"
,urn:cgls:global:lwq_v1_100,URN:CGLS:GLOBAL:LWQ_V1_100,URN:CGLS:GLOBAL:LWQ_V1_100,URN CGLS GLOBAL LWQ V1 100,CLMS GLOBAL LWQ V1 100,"['CLMS', 'GLOBAL', 'LWQ', 'V1', '100']"
,urn:cgls:global:lwq_v1_1km,URN:CGLS:GLOBAL:LWQ_V1_1KM,URN:CGLS:GLOBAL:LWQ_V1_1KM,URN CGLS GLOBAL LWQ V1 1KM,CLMS GLOBAL LWQ V1 1KM,"['CLMS', 'GLOBAL', 'LWQ', 'V1', '1KM']"
,urn:cgls:global:lwq_v1_1km_offline,URN:CGLS:GLOBAL:LWQ_V1_1KM_OFFLINE,URN:CGLS:GLOBAL:LWQ_V1_1KM_OFFLINE,URN CGLS GLOBAL LWQ V1 1KM OFFLINE,CLMS GLOBAL LWQ V1 1KM OFFLINE,"['CLMS', 'GLOBAL', 'LWQ', 'V1', '1KM', 'OFFLINE']"
,urn:cgls:global:lwq_v1_300,URN:CGLS:GLOBAL:LWQ_V1_300,URN:CGLS:GLOBAL:LWQ_V1_300,URN CGLS GLOBAL LWQ V1 300,CLMS GLOBAL LWQ V1 300,"['CLMS', 'GLOBAL', 'LWQ', 'V1', '300']"
,urn:cgls:global:lwq_v1_300_offline,URN:CGLS:GLOBAL:LWQ_V1_300_OFFLINE,URN:CGLS:GLOBAL:LWQ_V1_300_OFFLINE,URN CGLS GLOBAL LWQ V1 300 OFFLINE,CLMS GLOBAL LWQ V1 300 OFFLINE,"['CLMS', 'GLOBAL', 'LWQ', 'V1', '300', 'OFFLINE']"
,urn:cgls:global:ndvi-lts_v2_1km,URN:CGLS:GLOBAL:NDVI-LTS_V2_1KM,URN:CGLS:GLOBAL:NDVI-LTS_V2_1KM,URN CGLS GLOBAL NDVI LTS V2 1KM,CLMS GLOBAL NDVI LTS V2 1KM,"['CLMS', 'GLOBAL', 'NDVI', 'LTS', 'V2', '1KM']"
,urn:cgls:global:ndvi300_v1_333m,URN:CGLS:GLOBAL:NDVI300_V1_333M,URN:CGLS:GLOBAL:NDVI300_V1_333M,URN CGLS GLOBAL NDVI300 V1 333M,CLMS GLOBAL NDVI300 V1 333M,"['CLMS', 'GLOBAL', 'NDVI300', 'V1', '333M']"
,urn:cgls:global:ndvi300_v2_333m,URN:CGLS:GLOBAL:NDVI300_V2_333M,URN:CGLS:GLOBAL:NDVI300_V2_333M,URN CGLS GLOBAL NDVI300 V2 333M,CLMS GLOBAL NDVI300 V2 333M,"['CLMS', 'GLOBAL', 'NDVI300', 'V2', '333M']"
,urn:cgls:global:ndvi_stats_all,URN:CGLS:GLOBAL:NDVI_STATS_ALL,URN:CGLS:GLOBAL:NDVI_STATS_ALL,URN CGLS GLOBAL NDVI STATS ALL,CLMS GLOBAL NDVI STATS ALL,"['CLMS', 'GLOBAL', 'NDVI', 'STATS', 'ALL']"
,urn:cgls:global:ndvi_v2_1km,URN:CGLS:GLOBAL:NDVI_V2_1KM,URN:CGLS:GLOBAL:NDVI_V2_1KM,URN CGLS GLOBAL NDVI V2 1KM,CLMS GLOBAL NDVI V2 1KM,"['CLMS', 'GLOBAL', 'NDVI', 'V2', '1KM']"
,urn:cgls:global:ndvi_v3_1km,URN:CGLS:GLOBAL:NDVI_V3_1KM,URN:CGLS:GLOBAL:NDVI_V3_1KM,URN CGLS GLOBAL NDVI V3 1KM,CLMS GLOBAL NDVI V3 1KM,"['CLMS', 'GLOBAL', 'NDVI', 'V3', '1KM']"
,urn:cgls:global:sce_v1_0.01degree,URN:CGLS:GLOBAL:SCE_V1_0.01DEGREE,URN:CGLS:GLOBAL:SCE_V1_0.01DEGREE,URN CGLS GLOBAL SCE V1 0.01DEGREE,CLMS GLOBAL SCE V1 0.01DEGREE,"['CLMS', 'GLOBAL', 'SCE', 'V1', '0.01DEGREE']"
,urn:cgls:global:ssm_v1_1km,URN:CGLS:GLOBAL:SSM_V1_1KM,URN:CGLS:GLOBAL:SSM_V1_1KM,URN CGLS GLOBAL SSM V1 1KM,CLMS GLOBAL SSM V1 1KM,"['CLMS', 'GLOBAL', 'SSM', 'V1', '1KM']"
,urn:cgls:global:swe_V1_5km,URN:CGLS:GLOBAL:SWE_V1_5KM,URN:CGLS:GLOBAL:SWE_V1_5KM,URN CGLS GLOBAL SWE V1 5KM,CLMS GLOBAL SWE V1 5KM,"['CLMS', 'GLOBAL', 'SWE', 'V1', '5KM']"
,urn:cgls:global:swi-static_v3_0.1degree,URN:CGLS:GLOBAL:SWI-STATIC_V3_0.1DEGREE,URN:CGLS:GLOBAL:SWI-STATIC_V3_0.1DEGREE,URN CGLS GLOBAL SWI STATIC V3 0.1DEGREE,CLMS GLOBAL SWI STATIC V3 0.1DEGREE,"['CLMS', 'GLOBAL', 'SWI', 'STATIC', 'V3', '0.1DEGREE']"
,urn:cgls:global:swi10_v3_0.1degree,URN:CGLS:GLOBAL:SWI10_V3_0.1DEGREE,URN:CGLS:GLOBAL:SWI10_V3_0.1DEGREE,URN CGLS GLOBAL SWI10 V3 0.1DEGREE,CLMS GLOBAL SWI10 V3 0.1DEGREE,"['CLMS', 'GLOBAL', 'SWI10', 'V3', '0.1DEGREE']"
,urn:cgls:global:swi_v1_1km,URN:CGLS:GLOBAL:SWI_V1_1KM,URN:CGLS:GLOBAL:SWI_V1_1KM,URN CGLS GLOBAL SWI V1 1KM,CLMS GLOBAL SWI V1 1KM,"['CLMS', 'GLOBAL', 'SWI', 'V1', '1KM']"
,urn:cgls:global:swi_v3_0.1degree,URN:CGLS:GLOBAL:SWI_V3_0.1DEGREE,URN:CGLS:GLOBAL:SWI_V3_0.1DEGREE,URN CGLS GLOBAL SWI V3 0.1DEGREE,CLMS GLOBAL SWI V3 0.1DEGREE,"['CLMS', 'GLOBAL', 'SWI', 'V3', '0.1DEGREE']"
,urn:cgls:global:tocr_v1_1km,URN:CGLS:GLOBAL:TOCR_V1_1KM,URN:CGLS:GLOBAL:TOCR_V1_1KM,URN CGLS GLOBAL TOCR V1 1KM,CLMS GLOBAL TOCR V1 1KM,"['CLMS', 'GLOBAL', 'TOCR', 'V1', '1KM']"
,urn:cgls:global:wb300_v1_333m,URN:CGLS:GLOBAL:WB300_V1_333M,URN:CGLS:GLOBAL:WB300_V1_333M,URN CGLS GLOBAL WB300 V1 333M,CLMS GLOBAL WB300 V1 333M,"['CLMS', 'GLOBAL', 'WB300', 'V1', '333M']"
,urn:cgls:global:wb_v1_100m,URN:CGLS:GLOBAL:WB_V1_100M,URN:CGLS:GLOBAL:WB_V1_100M,URN CGLS GLOBAL WB V1 100M,CLMS GLOBAL WB V1 100M,"['CLMS', 'GLOBAL', 'WB', 'V1', '100M']"
,urn:cgls:global:wb_v2_1km,URN:CGLS:GLOBAL:WB_V2_1KM,URN:CGLS:GLOBAL:WB_V2_1KM,URN CGLS GLOBAL WB V2 1KM,CLMS GLOBAL WB V2 1KM,"['CLMS', 'GLOBAL', 'WB', 'V2', '1KM']"
,urn:cgls:global:wb_v2_300m,URN:CGLS:GLOBAL:WB_V2_300M,URN:CGLS:GLOBAL:WB_V2_300M,URN CGLS GLOBAL WB V2 300M,CLMS GLOBAL WB V2 300M,"['CLMS', 'GLOBAL', 'WB', 'V2', '300M']"
,urn:cgls:global:wl_v2_lakes,URN:CGLS:GLOBAL:WL_V2_LAKES,URN:CGLS:GLOBAL:WL_V2_LAKES,URN CGLS GLOBAL WL V2 LAKES,CLMS GLOBAL WL V2 LAKES,"['CLMS', 'GLOBAL', 'WL', 'V2', 'LAKES']"
,urn:cgls:global:wl_v2_rivers,URN:CGLS:GLOBAL:WL_V2_RIVERS,URN:CGLS:GLOBAL:WL_V2_RIVERS,URN CGLS GLOBAL WL V2 RIVERS,CLMS GLOBAL WL V2 RIVERS,"['CLMS', 'GLOBAL', 'WL', 'V2', 'RIVERS']"
,urn:cgls:tiles:swits_v3_12.5km,URN:CGLS:TILES:SWITS_V3_12.5KM,URN:CGLS:TILES:SWITS_V3_12.5KM,URN CGLS TILES SWITS V3 12.5KM,CLMS TILES SWITS V3 12.5KM,"['CLMS', 'TILES', 'SWITS', 'V3', '12.5KM']"
,urn:cgls:tiles:wb_v1_1km,URN:CGLS:TILES:WB_V1_1KM,URN:CGLS:TILES:WB_V1_1KM,URN CGLS TILES WB V1 1KM,CLMS TILES WB V1 1KM,"['CLMS', 'TILES', 'WB', 'V1', '1KM']"
